[
  {
    "schema_version": "1.0.0",
    "tenant_id": "demo-tenant",
    "engagement_id": "demo-engagement",
    "claim_id": "claim-business",
    "subject_id": "submission-demo",
    "predicate": "criterion:business",
    "value": "3",
    "source_artifact_id": "evidence-demo",
    "source_locator": "evidence.txt#1",
    "method": "static_review",
    "confidence": 0.5,
    "observed_at": "2026-10-21T13:05:00Z",
    "review_state": "verified",
    "reviewer_ref": "DEMO-not-real-verified"
  },
  {
    "schema_version": "1.0.0",
    "tenant_id": "demo-tenant",
    "engagement_id": "demo-engagement",
    "claim_id": "claim-functional",
    "subject_id": "submission-demo",
    "predicate": "criterion:functional",
    "value": "4",
    "source_artifact_id": "evidence-demo",
    "source_locator": "evidence.txt#1",
    "method": "test",
    "confidence": 0.5,
    "observed_at": "2026-10-21T13:05:00Z",
    "review_state": "verified",
    "reviewer_ref": "DEMO-not-real-verified"
  },
  {
    "schema_version": "1.0.0",
    "tenant_id": "demo-tenant",
    "engagement_id": "demo-engagement",
    "claim_id": "claim-safety",
    "subject_id": "submission-demo",
    "predicate": "criterion:safety",
    "value": "4",
    "source_artifact_id": "evidence-demo",
    "source_locator": "evidence.txt#1",
    "method": "static_review",
    "confidence": 0.5,
    "observed_at": "2026-10-21T13:05:00Z",
    "review_state": "verified",
    "reviewer_ref": "DEMO-not-real-verified"
  },
  {
    "schema_version": "1.0.0",
    "tenant_id": "demo-tenant",
    "engagement_id": "demo-engagement",
    "claim_id": "claim-feasibility",
    "subject_id": "submission-demo",
    "predicate": "criterion:feasibility",
    "value": "3",
    "source_artifact_id": "evidence-demo",
    "source_locator": "evidence.txt#1",
    "method": "static_review",
    "confidence": 0.5,
    "observed_at": "2026-10-21T13:05:00Z",
    "review_state": "verified",
    "reviewer_ref": "DEMO-not-real-verified"
  },
  {
    "schema_version": "1.0.0",
    "tenant_id": "demo-tenant",
    "engagement_id": "demo-engagement",
    "claim_id": "claim-clarity",
    "subject_id": "submission-demo",
    "predicate": "criterion:clarity",
    "value": "5",
    "source_artifact_id": "readme-demo",
    "source_locator": "README.md#1",
    "method": "human_observation",
    "confidence": 0.5,
    "observed_at": "2026-10-21T13:05:00Z",
    "review_state": "verified",
    "reviewer_ref": "DEMO-not-real-verified"
  },
  {
    "schema_version": "1.0.0",
    "tenant_id": "demo-tenant",
    "engagement_id": "demo-engagement",
    "claim_id": "claim-skill-doc",
    "subject_id": "participant-001",
    "predicate": "skill:skill:documentation",
    "value": "Contribución documental observada",
    "source_artifact_id": "evidence-demo",
    "source_locator": "evidence.txt#1",
    "method": "human_observation",
    "confidence": 0.4,
    "observed_at": "2026-10-21T13:06:00Z",
    "review_state": "verified",
    "reviewer_ref": "DEMO-not-real-verified"
  }
]
